{
  "schema": "result.v1",
  "project": "actordock",
  "suite": "warm-resume",
  "target_ref": "49ff499cb34856be3c32ca686df633be3efb13b3",
  "timestamp": "2026-06-27T03:25:40.751810+00:00",
  "env": {
    "runner": "harness",
    "cluster": "kind"
  },
  "run": {
    "users": 1,
    "spawn_rate": 1.0,
    "duration_s": 60
  },
  "metrics": {}
}
